#-----------------------------------------------------------
# Vivado v2020.1 (64-bit)
# SW Build 2902540 on Wed May 27 19:54:49 MDT 2020
# IP Build 2902112 on Wed May 27 22:43:36 MDT 2020
# Start of session at: Wed Nov  8 15:19:58 2023
# Process ID: 14524
# Current directory: C:/Xilinx/SST/week2/project_1
# Command line: vivado.exe -gui_launcher_event rodinguilauncherevent16488 C:\Xilinx\SST\week2\project_1\project_1.xpr
# Log file: C:/Xilinx/SST/week2/project_1/vivado.log
# Journal file: C:/Xilinx/SST/week2/project_1\vivado.jou
#-----------------------------------------------------------
start_gui
open_project C:/Xilinx/SST/week2/project_1/project_1.xpr
Scanning sources...
Finished scanning sources
INFO: [IP_Flow 19-234] Refreshing IP repositories
INFO: [IP_Flow 19-1704] No user IP repositories specified
INFO: [IP_Flow 19-2313] Loaded Vivado IP repository 'C:/Xilinx/Vivado/2020.1/data/ip'.
open_project: Time (s): cpu = 00:00:12 ; elapsed = 00:00:05 . Memory (MB): peak = 1027.969 ; gain = 0.000
update_compile_order -fileset sources_1
reset_run synth_1
launch_runs synth_1 -jobs 6
[Wed Nov  8 15:26:41 2023] Launched synth_1...
Run output will be captured here: C:/Xilinx/SST/week2/project_1/project_1.runs/synth_1/runme.log
launch_runs impl_1 -jobs 6
[Wed Nov  8 15:27:53 2023] Launched impl_1...
Run output will be captured here: C:/Xilinx/SST/week2/project_1/project_1.runs/impl_1/runme.log
open_run impl_1
INFO: [Device 21-403] Loading part xc7a100tcsg324-1
Netlist sorting complete. Time (s): cpu = 00:00:00 ; elapsed = 00:00:00 . Memory (MB): peak = 1124.453 ; gain = 0.000
INFO: [Project 1-479] Netlist was created with Vivado 2020.1
INFO: [Project 1-570] Preparing netlist for logic optimization
INFO: [Timing 38-478] Restoring timing data from binary archive.
INFO: [Timing 38-479] Binary timing data restore complete.
INFO: [Project 1-856] Restoring constraints from binary archive.
INFO: [Project 1-853] Binary constraint restore complete.
Reading XDEF placement.
Reading placer database...
Reading XDEF routing.
Read XDEF File: Time (s): cpu = 00:00:00 ; elapsed = 00:00:00.030 . Memory (MB): peak = 1770.531 ; gain = 0.000
Restored from archive | CPU: 0.000000 secs | Memory: 0.000000 MB |
Finished XDEF File Restore: Time (s): cpu = 00:00:00 ; elapsed = 00:00:00.030 . Memory (MB): peak = 1770.531 ; gain = 0.000
Netlist sorting complete. Time (s): cpu = 00:00:00 ; elapsed = 00:00:00 . Memory (MB): peak = 1770.531 ; gain = 0.000
INFO: [Project 1-111] Unisim Transformation Summary:
No Unisim elements were transformed.

open_run: Time (s): cpu = 00:00:22 ; elapsed = 00:00:18 . Memory (MB): peak = 1905.234 ; gain = 879.340
WARNING: [Timing 38-313] There are no user specified timing constraints. Timing constraints are needed for proper timing analysis.
report_timing_summary -delay_type min_max -report_unconstrained -check_timing_verbose -max_paths 10 -input_pins -routable_nets -datasheet -name timing_1
INFO: [Timing 38-91] UpdateTimingParams: Speed grade: -1, Delay Type: min_max.
INFO: [Timing 38-191] Multithreading enabled for timing update using a maximum of 2 CPUs
close_design
synth_design -rtl -name rtl_1
Command: synth_design -rtl -name rtl_1
Starting synth_design
Using part: xc7a100tcsg324-1
Top: top_module
---------------------------------------------------------------------------------
Starting RTL Elaboration : Time (s): cpu = 00:00:04 ; elapsed = 00:00:04 . Memory (MB): peak = 1937.477 ; gain = 0.000
---------------------------------------------------------------------------------
INFO: [Synth 8-6157] synthesizing module 'top_module' [C:/Xilinx/SST/week2/project_1/project_1.srcs/sources_1/new/top_module.v:6]
INFO: [Synth 8-6157] synthesizing module 'DEMULTIPLEXER' [C:/Xilinx/SST/week2/project_1/project_1.srcs/sources_1/new/MSI_Library.v:3]
ERROR: [Synth 8-439] module 'not_S0' not found [C:/Xilinx/SST/week2/project_1/project_1.srcs/sources_1/new/MSI_Library.v:11]
ERROR: [Synth 8-6156] failed synthesizing module 'DEMULTIPLEXER' [C:/Xilinx/SST/week2/project_1/project_1.srcs/sources_1/new/MSI_Library.v:3]
ERROR: [Synth 8-6156] failed synthesizing module 'top_module' [C:/Xilinx/SST/week2/project_1/project_1.srcs/sources_1/new/top_module.v:6]
---------------------------------------------------------------------------------
Finished RTL Elaboration : Time (s): cpu = 00:00:05 ; elapsed = 00:00:05 . Memory (MB): peak = 1966.883 ; gain = 29.406
---------------------------------------------------------------------------------
RTL Elaboration failed
2 Infos, 0 Warnings, 0 Critical Warnings and 4 Errors encountered.
synth_design failed
ERROR: [Vivado_Tcl 4-5] Elaboration failed - please see the console for details
synth_design -rtl -name rtl_1
Command: synth_design -rtl -name rtl_1
Starting synth_design
Using part: xc7a100tcsg324-1
Top: top_module
---------------------------------------------------------------------------------
Starting RTL Elaboration : Time (s): cpu = 00:00:04 ; elapsed = 00:00:04 . Memory (MB): peak = 1967.207 ; gain = 0.324
---------------------------------------------------------------------------------
INFO: [Synth 8-6157] synthesizing module 'top_module' [C:/Xilinx/SST/week2/project_1/project_1.srcs/sources_1/new/top_module.v:6]
INFO: [Synth 8-6157] synthesizing module 'DEMULTIPLEXER' [C:/Xilinx/SST/week2/project_1/project_1.srcs/sources_1/new/MSI_Library.v:3]
ERROR: [Synth 8-439] module 'NOT' not found [C:/Xilinx/SST/week2/project_1/project_1.srcs/sources_1/new/MSI_Library.v:11]
ERROR: [Synth 8-6156] failed synthesizing module 'DEMULTIPLEXER' [C:/Xilinx/SST/week2/project_1/project_1.srcs/sources_1/new/MSI_Library.v:3]
ERROR: [Synth 8-6156] failed synthesizing module 'top_module' [C:/Xilinx/SST/week2/project_1/project_1.srcs/sources_1/new/top_module.v:6]
---------------------------------------------------------------------------------
Finished RTL Elaboration : Time (s): cpu = 00:00:04 ; elapsed = 00:00:04 . Memory (MB): peak = 1973.129 ; gain = 6.246
---------------------------------------------------------------------------------
RTL Elaboration failed
2 Infos, 0 Warnings, 0 Critical Warnings and 4 Errors encountered.
synth_design failed
ERROR: [Vivado_Tcl 4-5] Elaboration failed - please see the console for details
update_compile_order -fileset sources_1
reset_run synth_1
launch_runs synth_1 -jobs 6
[Wed Nov  8 15:35:22 2023] Launched synth_1...
Run output will be captured here: C:/Xilinx/SST/week2/project_1/project_1.runs/synth_1/runme.log
reset_run synth_1
launch_runs synth_1 -jobs 6
[Wed Nov  8 15:38:04 2023] Launched synth_1...
Run output will be captured here: C:/Xilinx/SST/week2/project_1/project_1.runs/synth_1/runme.log
launch_simulation
Command: launch_simulation 
INFO: [Vivado 12-5682] Launching behavioral simulation in 'C:/Xilinx/SST/week2/project_1/project_1.sim/sim_1/behav/xsim'
INFO: [SIM-utils-51] Simulation object is 'sim_1'
INFO: [SIM-utils-54] Inspecting design source files for 'decoder_tb' in fileset 'sim_1'...
INFO: [USF-XSim-97] Finding global include files...
INFO: [USF-XSim-98] Fetching design files from 'sim_1'...
INFO: [USF-XSim-2] XSim::Compile design
INFO: [USF-XSim-61] Executing 'COMPILE and ANALYZE' step in 'C:/Xilinx/SST/week2/project_1/project_1.sim/sim_1/behav/xsim'
"xvlog --incr --relax -prj decoder_tb_vlog.prj"
INFO: [VRFC 10-2263] Analyzing Verilog file "C:/Xilinx/SST/week2/project_1/project_1.srcs/sources_1/new/MSI_Library.v" into library xil_defaultlib
INFO: [VRFC 10-311] analyzing module DEMULTIPLEXER
INFO: [VRFC 10-311] analyzing module MULTIPLEXER
INFO: [VRFC 10-311] analyzing module ENCODER
INFO: [VRFC 10-311] analyzing module DECODER
INFO: [VRFC 10-2263] Analyzing Verilog file "C:/Xilinx/SST/week1/all_libs/project_2.srcs/sources_1/new/SSI_Library.v" into library xil_defaultlib
INFO: [VRFC 10-311] analyzing module AND
INFO: [VRFC 10-311] analyzing module OR
INFO: [VRFC 10-311] analyzing module NOT
INFO: [VRFC 10-311] analyzing module NAND
INFO: [VRFC 10-311] analyzing module NOR
INFO: [VRFC 10-311] analyzing module EXOR
INFO: [VRFC 10-311] analyzing module EXNOR
INFO: [VRFC 10-311] analyzing module TRI
INFO: [VRFC 10-2263] Analyzing Verilog file "C:/Xilinx/SST/week2/project_1/project_1.srcs/sources_1/new/top_module.v" into library xil_defaultlib
INFO: [VRFC 10-311] analyzing module top_module
INFO: [VRFC 10-2263] Analyzing Verilog file "C:/Xilinx/SST/week2/project_1/project_1.srcs/sim_1/new/decoder_tb.v" into library xil_defaultlib
INFO: [VRFC 10-311] analyzing module decoder_tb
INFO: [USF-XSim-69] 'compile' step finished in '2' seconds
INFO: [USF-XSim-3] XSim::Elaborate design
INFO: [USF-XSim-61] Executing 'ELABORATE' step in 'C:/Xilinx/SST/week2/project_1/project_1.sim/sim_1/behav/xsim'
"xelab -wto 7bfcc9370c4346af8a8722df43128d8e --incr --debug typical --relax --mt 2 -L xil_defaultlib -L unisims_ver -L unimacro_ver -L secureip --snapshot decoder_tb_behav xil_defaultlib.decoder_tb xil_defaultlib.glbl -log elaborate.log"
Vivado Simulator 2020.1
Copyright 1986-1999, 2001-2020 Xilinx, Inc. All Rights Reserved.
Running: C:/Xilinx/Vivado/2020.1/bin/unwrapped/win64.o/xelab.exe -wto 7bfcc9370c4346af8a8722df43128d8e --incr --debug typical --relax --mt 2 -L xil_defaultlib -L unisims_ver -L unimacro_ver -L secureip --snapshot decoder_tb_behav xil_defaultlib.decoder_tb xil_defaultlib.glbl -log elaborate.log 
Using 2 slave threads.
Starting static elaboration
Pass Through NonSizing Optimizer
Completed static elaboration
Starting simulation data flow analysis
Completed simulation data flow analysis
Time Resolution for simulation is 1ps
Compiling module xil_defaultlib.NOT
Compiling module xil_defaultlib.AND
Compiling module xil_defaultlib.TRI
Compiling module xil_defaultlib.DEMULTIPLEXER
Compiling module xil_defaultlib.top_module
Compiling module xil_defaultlib.decoder_tb
Compiling module xil_defaultlib.glbl
Built simulation snapshot decoder_tb_behav

****** Webtalk v2020.1 (64-bit)
  **** SW Build 2902540 on Wed May 27 19:54:49 MDT 2020
  **** IP Build 2902112 on Wed May 27 22:43:36 MDT 2020
    ** Copyright 1986-2020 Xilinx, Inc. All Rights Reserved.

source C:/Xilinx/SST/week2/project_1/project_1.sim/sim_1/behav/xsim/xsim.dir/decoder_tb_behav/webtalk/xsim_webtalk.tcl -notrace
INFO: [Common 17-206] Exiting Webtalk at Wed Nov  8 15:39:05 2023...
INFO: [USF-XSim-69] 'elaborate' step finished in '4' seconds
INFO: [USF-XSim-4] XSim::Simulate design
INFO: [USF-XSim-61] Executing 'SIMULATE' step in 'C:/Xilinx/SST/week2/project_1/project_1.sim/sim_1/behav/xsim'
INFO: [USF-XSim-98] *** Running xsim
   with args "decoder_tb_behav -key {Behavioral:sim_1:Functional:decoder_tb} -tclbatch {decoder_tb.tcl} -log {simulate.log}"
INFO: [USF-XSim-8] Loading simulator feature
Vivado Simulator 2020.1
Time resolution is 1 ps
source decoder_tb.tcl
# set curr_wave [current_wave_config]
# if { [string length $curr_wave] == 0 } {
#   if { [llength [get_objects]] > 0} {
#     add_wave /
#     set_property needs_save false [current_wave_config]
#   } else {
#      send_msg_id Add_Wave-1 WARNING "No top level signals found. Simulator will start without a wave window. If you want to open a wave window go to 'File->New Waveform Configuration' or type 'create_wave_config' in the TCL console."
#   }
# }
# run 1000ns
$finish called at time : 160 ns : File "C:/Xilinx/SST/week2/project_1/project_1.srcs/sim_1/new/decoder_tb.v" Line 29
INFO: [USF-XSim-96] XSim completed. Design snapshot 'decoder_tb_behav' loaded.
INFO: [USF-XSim-97] XSim simulation ran for 1000ns
launch_simulation: Time (s): cpu = 00:00:06 ; elapsed = 00:00:10 . Memory (MB): peak = 2010.711 ; gain = 28.484
set_property top demux_tb [get_filesets sim_1]
set_property top_lib xil_defaultlib [get_filesets sim_1]
update_compile_order -fileset sim_1
launch_simulation
Command: launch_simulation 
boost::filesystem::remove: Dosya baþka bir iþlem tarafýndan kullanýldýðýndan bu iþlem dosyaya eriþemiyor: "C:/Xilinx/SST/week2/project_1/project_1.sim/sim_1/behav/xsim/simulate.log"
close_sim
INFO: [Simtcl 6-16] Simulation closed
launch_simulation
Command: launch_simulation 
INFO: [Vivado 12-5682] Launching behavioral simulation in 'C:/Xilinx/SST/week2/project_1/project_1.sim/sim_1/behav/xsim'
INFO: [SIM-utils-51] Simulation object is 'sim_1'
INFO: [SIM-utils-54] Inspecting design source files for 'demux_tb' in fileset 'sim_1'...
INFO: [USF-XSim-97] Finding global include files...
INFO: [USF-XSim-98] Fetching design files from 'sim_1'...
INFO: [USF-XSim-2] XSim::Compile design
INFO: [USF-XSim-61] Executing 'COMPILE and ANALYZE' step in 'C:/Xilinx/SST/week2/project_1/project_1.sim/sim_1/behav/xsim'
"xvlog --incr --relax -prj demux_tb_vlog.prj"
INFO: [VRFC 10-2263] Analyzing Verilog file "C:/Xilinx/SST/week2/project_1/project_1.srcs/sources_1/new/MSI_Library.v" into library xil_defaultlib
INFO: [VRFC 10-311] analyzing module DEMULTIPLEXER
INFO: [VRFC 10-311] analyzing module MULTIPLEXER
INFO: [VRFC 10-311] analyzing module ENCODER
INFO: [VRFC 10-311] analyzing module DECODER
INFO: [VRFC 10-2263] Analyzing Verilog file "C:/Xilinx/SST/week1/all_libs/project_2.srcs/sources_1/new/SSI_Library.v" into library xil_defaultlib
INFO: [VRFC 10-311] analyzing module AND
INFO: [VRFC 10-311] analyzing module OR
INFO: [VRFC 10-311] analyzing module NOT
INFO: [VRFC 10-311] analyzing module NAND
INFO: [VRFC 10-311] analyzing module NOR
INFO: [VRFC 10-311] analyzing module EXOR
INFO: [VRFC 10-311] analyzing module EXNOR
INFO: [VRFC 10-311] analyzing module TRI
INFO: [VRFC 10-2263] Analyzing Verilog file "C:/Xilinx/SST/week2/project_1/project_1.srcs/sources_1/new/top_module.v" into library xil_defaultlib
INFO: [VRFC 10-311] analyzing module top_module
INFO: [VRFC 10-2263] Analyzing Verilog file "C:/Xilinx/SST/week2/project_1/project_1.srcs/sim_1/new/demux_tb.v" into library xil_defaultlib
INFO: [VRFC 10-311] analyzing module demux_tb
INFO: [USF-XSim-69] 'compile' step finished in '1' seconds
INFO: [USF-XSim-3] XSim::Elaborate design
INFO: [USF-XSim-61] Executing 'ELABORATE' step in 'C:/Xilinx/SST/week2/project_1/project_1.sim/sim_1/behav/xsim'
"xelab -wto 7bfcc9370c4346af8a8722df43128d8e --incr --debug typical --relax --mt 2 -L xil_defaultlib -L unisims_ver -L unimacro_ver -L secureip --snapshot demux_tb_behav xil_defaultlib.demux_tb xil_defaultlib.glbl -log elaborate.log"
Vivado Simulator 2020.1
Copyright 1986-1999, 2001-2020 Xilinx, Inc. All Rights Reserved.
Running: C:/Xilinx/Vivado/2020.1/bin/unwrapped/win64.o/xelab.exe -wto 7bfcc9370c4346af8a8722df43128d8e --incr --debug typical --relax --mt 2 -L xil_defaultlib -L unisims_ver -L unimacro_ver -L secureip --snapshot demux_tb_behav xil_defaultlib.demux_tb xil_defaultlib.glbl -log elaborate.log 
Using 2 slave threads.
Starting static elaboration
Pass Through NonSizing Optimizer
Completed static elaboration
Starting simulation data flow analysis
Completed simulation data flow analysis
Time Resolution for simulation is 1ps
Compiling module xil_defaultlib.NOT
Compiling module xil_defaultlib.AND
Compiling module xil_defaultlib.TRI
Compiling module xil_defaultlib.DEMULTIPLEXER
Compiling module xil_defaultlib.top_module
Compiling module xil_defaultlib.demux_tb
Compiling module xil_defaultlib.glbl
Built simulation snapshot demux_tb_behav

****** Webtalk v2020.1 (64-bit)
  **** SW Build 2902540 on Wed May 27 19:54:49 MDT 2020
  **** IP Build 2902112 on Wed May 27 22:43:36 MDT 2020
    ** Copyright 1986-2020 Xilinx, Inc. All Rights Reserved.

source C:/Xilinx/SST/week2/project_1/project_1.sim/sim_1/behav/xsim/xsim.dir/demux_tb_behav/webtalk/xsim_webtalk.tcl -notrace
INFO: [Common 17-206] Exiting Webtalk at Wed Nov  8 15:39:52 2023...
INFO: [USF-XSim-69] 'elaborate' step finished in '3' seconds
INFO: [USF-XSim-4] XSim::Simulate design
INFO: [USF-XSim-61] Executing 'SIMULATE' step in 'C:/Xilinx/SST/week2/project_1/project_1.sim/sim_1/behav/xsim'
INFO: [USF-XSim-98] *** Running xsim
   with args "demux_tb_behav -key {Behavioral:sim_1:Functional:demux_tb} -tclbatch {demux_tb.tcl} -log {simulate.log}"
INFO: [USF-XSim-8] Loading simulator feature
Vivado Simulator 2020.1
Time resolution is 1 ps
source demux_tb.tcl
# set curr_wave [current_wave_config]
# if { [string length $curr_wave] == 0 } {
#   if { [llength [get_objects]] > 0} {
#     add_wave /
#     set_property needs_save false [current_wave_config]
#   } else {
#      send_msg_id Add_Wave-1 WARNING "No top level signals found. Simulator will start without a wave window. If you want to open a wave window go to 'File->New Waveform Configuration' or type 'create_wave_config' in the TCL console."
#   }
# }
# run 1000ns
$finish called at time : 50 ns : File "C:/Xilinx/SST/week2/project_1/project_1.srcs/sim_1/new/demux_tb.v" Line 18
INFO: [USF-XSim-96] XSim completed. Design snapshot 'demux_tb_behav' loaded.
INFO: [USF-XSim-97] XSim simulation ran for 1000ns
launch_simulation: Time (s): cpu = 00:00:05 ; elapsed = 00:00:07 . Memory (MB): peak = 2050.762 ; gain = 33.812
close_sim
ERROR: [Vivado 12-106] *** Exception: java.lang.NullPointerException (See C:/Xilinx/SST/week2/project_1/vivado_pid14752.debug)
INFO: [Simtcl 6-16] Simulation closed
close_sim: Time (s): cpu = 00:00:03 ; elapsed = 00:00:09 . Memory (MB): peak = 2050.762 ; gain = 0.000
ERROR: [Common 17-39] 'close_sim' failed due to earlier errors.
launch_simulation
Command: launch_simulation 
INFO: [Vivado 12-5682] Launching behavioral simulation in 'C:/Xilinx/SST/week2/project_1/project_1.sim/sim_1/behav/xsim'
INFO: [SIM-utils-51] Simulation object is 'sim_1'
INFO: [SIM-utils-54] Inspecting design source files for 'demux_tb' in fileset 'sim_1'...
INFO: [USF-XSim-97] Finding global include files...
INFO: [USF-XSim-98] Fetching design files from 'sim_1'...
INFO: [USF-XSim-2] XSim::Compile design
INFO: [USF-XSim-61] Executing 'COMPILE and ANALYZE' step in 'C:/Xilinx/SST/week2/project_1/project_1.sim/sim_1/behav/xsim'
"xvlog --incr --relax -prj demux_tb_vlog.prj"
INFO: [VRFC 10-2263] Analyzing Verilog file "C:/Xilinx/SST/week2/project_1/project_1.srcs/sim_1/new/demux_tb.v" into library xil_defaultlib
INFO: [VRFC 10-311] analyzing module demux_tb
INFO: [USF-XSim-69] 'compile' step finished in '1' seconds
INFO: [USF-XSim-3] XSim::Elaborate design
INFO: [USF-XSim-61] Executing 'ELABORATE' step in 'C:/Xilinx/SST/week2/project_1/project_1.sim/sim_1/behav/xsim'
"xelab -wto 7bfcc9370c4346af8a8722df43128d8e --incr --debug typical --relax --mt 2 -L xil_defaultlib -L unisims_ver -L unimacro_ver -L secureip --snapshot demux_tb_behav xil_defaultlib.demux_tb xil_defaultlib.glbl -log elaborate.log"
Vivado Simulator 2020.1
Copyright 1986-1999, 2001-2020 Xilinx, Inc. All Rights Reserved.
Running: C:/Xilinx/Vivado/2020.1/bin/unwrapped/win64.o/xelab.exe -wto 7bfcc9370c4346af8a8722df43128d8e --incr --debug typical --relax --mt 2 -L xil_defaultlib -L unisims_ver -L unimacro_ver -L secureip --snapshot demux_tb_behav xil_defaultlib.demux_tb xil_defaultlib.glbl -log elaborate.log 
Using 2 slave threads.
Starting static elaboration
Pass Through NonSizing Optimizer
Completed static elaboration
Starting simulation data flow analysis
Completed simulation data flow analysis
Time Resolution for simulation is 1ps
Compiling module xil_defaultlib.NOT
Compiling module xil_defaultlib.AND
Compiling module xil_defaultlib.TRI
Compiling module xil_defaultlib.DEMULTIPLEXER
Compiling module xil_defaultlib.top_module
Compiling module xil_defaultlib.demux_tb
Compiling module xil_defaultlib.glbl
Built simulation snapshot demux_tb_behav
INFO: [USF-XSim-69] 'elaborate' step finished in '1' seconds
INFO: [USF-XSim-4] XSim::Simulate design
INFO: [USF-XSim-61] Executing 'SIMULATE' step in 'C:/Xilinx/SST/week2/project_1/project_1.sim/sim_1/behav/xsim'
INFO: [USF-XSim-98] *** Running xsim
   with args "demux_tb_behav -key {Behavioral:sim_1:Functional:demux_tb} -tclbatch {demux_tb.tcl} -log {simulate.log}"
INFO: [USF-XSim-8] Loading simulator feature
Vivado Simulator 2020.1
Time resolution is 1 ps
source demux_tb.tcl
# set curr_wave [current_wave_config]
# if { [string length $curr_wave] == 0 } {
#   if { [llength [get_objects]] > 0} {
#     add_wave /
#     set_property needs_save false [current_wave_config]
#   } else {
#      send_msg_id Add_Wave-1 WARNING "No top level signals found. Simulator will start without a wave window. If you want to open a wave window go to 'File->New Waveform Configuration' or type 'create_wave_config' in the TCL console."
#   }
# }
# run 1000ns
$finish called at time : 40 ns : File "C:/Xilinx/SST/week2/project_1/project_1.srcs/sim_1/new/demux_tb.v" Line 17
INFO: [USF-XSim-96] XSim completed. Design snapshot 'demux_tb_behav' loaded.
INFO: [USF-XSim-97] XSim simulation ran for 1000ns
launch_simulation: Time (s): cpu = 00:00:07 ; elapsed = 00:00:07 . Memory (MB): peak = 2103.234 ; gain = 52.473
synth_design -rtl -name rtl_1
Command: synth_design -rtl -name rtl_1
Starting synth_design
Using part: xc7a100tcsg324-1
Top: top_module
---------------------------------------------------------------------------------
Starting RTL Elaboration : Time (s): cpu = 00:00:04 ; elapsed = 00:00:04 . Memory (MB): peak = 2179.758 ; gain = 13.438
---------------------------------------------------------------------------------
INFO: [Synth 8-6157] synthesizing module 'top_module' [C:/Xilinx/SST/week2/project_1/project_1.srcs/sources_1/new/top_module.v:3]
INFO: [Synth 8-6157] synthesizing module 'DEMULTIPLEXER' [C:/Xilinx/SST/week2/project_1/project_1.srcs/sources_1/new/MSI_Library.v:3]
INFO: [Synth 8-6157] synthesizing module 'NOT' [C:/Xilinx/SST/week1/all_libs/project_2.srcs/sources_1/new/SSI_Library.v:18]
INFO: [Synth 8-6155] done synthesizing module 'NOT' (1#1) [C:/Xilinx/SST/week1/all_libs/project_2.srcs/sources_1/new/SSI_Library.v:18]
INFO: [Synth 8-6157] synthesizing module 'AND' [C:/Xilinx/SST/week1/all_libs/project_2.srcs/sources_1/new/SSI_Library.v:4]
INFO: [Synth 8-6155] done synthesizing module 'AND' (2#1) [C:/Xilinx/SST/week1/all_libs/project_2.srcs/sources_1/new/SSI_Library.v:4]
INFO: [Synth 8-6157] synthesizing module 'TRI' [C:/Xilinx/SST/week1/all_libs/project_2.srcs/sources_1/new/SSI_Library.v:87]
INFO: [Synth 8-6155] done synthesizing module 'TRI' (3#1) [C:/Xilinx/SST/week1/all_libs/project_2.srcs/sources_1/new/SSI_Library.v:87]
INFO: [Synth 8-6155] done synthesizing module 'DEMULTIPLEXER' (4#1) [C:/Xilinx/SST/week2/project_1/project_1.srcs/sources_1/new/MSI_Library.v:3]
INFO: [Synth 8-6155] done synthesizing module 'top_module' (5#1) [C:/Xilinx/SST/week2/project_1/project_1.srcs/sources_1/new/top_module.v:3]
---------------------------------------------------------------------------------
Finished RTL Elaboration : Time (s): cpu = 00:00:04 ; elapsed = 00:00:05 . Memory (MB): peak = 2179.758 ; gain = 13.438
---------------------------------------------------------------------------------
---------------------------------------------------------------------------------
Start Handling Custom Attributes
---------------------------------------------------------------------------------
---------------------------------------------------------------------------------
Finished Handling Custom Attributes : Time (s): cpu = 00:00:05 ; elapsed = 00:00:05 . Memory (MB): peak = 2187.672 ; gain = 21.352
---------------------------------------------------------------------------------
---------------------------------------------------------------------------------
Finished RTL Optimization Phase 1 : Time (s): cpu = 00:00:05 ; elapsed = 00:00:05 . Memory (MB): peak = 2187.672 ; gain = 21.352
---------------------------------------------------------------------------------
Netlist sorting complete. Time (s): cpu = 00:00:00 ; elapsed = 00:00:00 . Memory (MB): peak = 2187.672 ; gain = 0.000
INFO: [Project 1-570] Preparing netlist for logic optimization

Processing XDC Constraints
Initializing timing engine
Parsing XDC File [C:/Xilinx/SST/week2/project_1/Nexys-A7-100T-Master.xdc]
Finished Parsing XDC File [C:/Xilinx/SST/week2/project_1/Nexys-A7-100T-Master.xdc]
Completed Processing XDC Constraints

INFO: [Opt 31-138] Pushed 0 inverter(s) to 0 load pin(s).
Netlist sorting complete. Time (s): cpu = 00:00:00 ; elapsed = 00:00:00 . Memory (MB): peak = 2277.105 ; gain = 0.000
INFO: [Project 1-111] Unisim Transformation Summary:
No Unisim elements were transformed.

RTL Elaboration Complete:  : Time (s): cpu = 00:00:11 ; elapsed = 00:00:07 . Memory (MB): peak = 2277.105 ; gain = 110.785
13 Infos, 0 Warnings, 0 Critical Warnings and 0 Errors encountered.
synth_design completed successfully
synth_design: Time (s): cpu = 00:00:11 ; elapsed = 00:00:07 . Memory (MB): peak = 2277.105 ; gain = 110.785
write_schematic -format pdf -orientation portrait C:/Xilinx/SST/week2/project_1/project_1.xpr/demux_rtl_schematic.pdf
WARNING: [Vivado 12-3279] write_schematic failed. Parent directory for  'C:/Xilinx/SST/week2/project_1/project_1.xpr/demux_rtl_schematic.pdf'  does not have write permission.
open_run synth_1 -name synth_1
Design is defaulting to impl run constrset: constrs_1
Design is defaulting to synth run part: xc7a100tcsg324-1
Netlist sorting complete. Time (s): cpu = 00:00:00 ; elapsed = 00:00:00 . Memory (MB): peak = 2277.105 ; gain = 0.000
INFO: [Project 1-479] Netlist was created with Vivado 2020.1
INFO: [Project 1-570] Preparing netlist for logic optimization
Parsing XDC File [C:/Xilinx/SST/week2/project_1/Nexys-A7-100T-Master.xdc]
Finished Parsing XDC File [C:/Xilinx/SST/week2/project_1/Nexys-A7-100T-Master.xdc]
INFO: [Opt 31-138] Pushed 0 inverter(s) to 0 load pin(s).
Netlist sorting complete. Time (s): cpu = 00:00:00 ; elapsed = 00:00:00 . Memory (MB): peak = 2282.211 ; gain = 0.000
INFO: [Project 1-111] Unisim Transformation Summary:
No Unisim elements were transformed.

write_schematic -format pdf -orientation portrait C:/Xilinx/SST/week2/project_1/demux_tech_schematic.pdf
C:/Xilinx/SST/week2/project_1/demux_tech_schematic.pdf
launch_runs impl_1 -jobs 6
INFO: [Timing 38-480] Writing timing data to binary archive.
Writing placer database...
Writing XDEF routing.
Writing XDEF routing logical nets.
Writing XDEF routing special nets.
Write XDEF Complete: Time (s): cpu = 00:00:00 ; elapsed = 00:00:00.030 . Memory (MB): peak = 2634.941 ; gain = 14.812
[Wed Nov  8 15:46:11 2023] Launched impl_1...
Run output will be captured here: C:/Xilinx/SST/week2/project_1/project_1.runs/impl_1/runme.log
close_design
open_run impl_1
Netlist sorting complete. Time (s): cpu = 00:00:00 ; elapsed = 00:00:00 . Memory (MB): peak = 2634.941 ; gain = 0.000
INFO: [Project 1-479] Netlist was created with Vivado 2020.1
INFO: [Project 1-570] Preparing netlist for logic optimization
INFO: [Timing 38-478] Restoring timing data from binary archive.
INFO: [Timing 38-479] Binary timing data restore complete.
INFO: [Project 1-856] Restoring constraints from binary archive.
INFO: [Project 1-853] Binary constraint restore complete.
Reading XDEF placement.
Reading placer database...
Reading XDEF routing.
Read XDEF File: Time (s): cpu = 00:00:00 ; elapsed = 00:00:00.031 . Memory (MB): peak = 2634.941 ; gain = 0.000
Restored from archive | CPU: 0.000000 secs | Memory: 0.000000 MB |
Finished XDEF File Restore: Time (s): cpu = 00:00:00 ; elapsed = 00:00:00.031 . Memory (MB): peak = 2634.941 ; gain = 0.000
Netlist sorting complete. Time (s): cpu = 00:00:00 ; elapsed = 00:00:00 . Memory (MB): peak = 2634.941 ; gain = 0.000
INFO: [Project 1-111] Unisim Transformation Summary:
No Unisim elements were transformed.

WARNING: [Timing 38-313] There are no user specified timing constraints. Timing constraints are needed for proper timing analysis.
launch_runs impl_1 -to_step write_bitstream -jobs 6
[Wed Nov  8 15:47:43 2023] Launched impl_1...
Run output will be captured here: C:/Xilinx/SST/week2/project_1/project_1.runs/impl_1/runme.log
